<?xml version="1.0" encoding="UTF-8"?>
<!DOCTYPE ModelUnit PUBLIC " " "https://raw.githubusercontent.com/AgriculturalModelExchangeInitiative/crop2ml/master/ModelUnit.dtd">
<ModelUnit modelid="Crop2ML.original.LeafNumber" name="LeafNumber" timestep="1" version="001">
    <Description>
        <Title>LeafNumber model</Title>
        <Authors>Pierre MARTRE</Authors>
        <Institution>INRA Montpellier</Institution>
        <URI></URI>
        <Reference>(&apos;&apos;,)</Reference>
        <ExtendedDescription>calculate leaf number. LeafNumber increase is caped at one more leaf per day</ExtendedDescription>
        <ShortDescription></ShortDescription></Description>
    <Inputs>
        <Input name="deltaTT" description="Thermal time increase of the day" inputtype="variable" variablecategory="auxiliary" datatype="DOUBLE" max="100.0" min="0.0" default="0.0" unit="Â°C d"/>
        <Input name="phyllochron_t1" description="phyllochron" inputtype="variable" variablecategory="state" datatype="DOUBLE" max="1000" min="0" default="0" unit="Â°C d leaf-1"/>
        <Input name="hasFlagLeafLiguleAppeared" description="true if flag leaf has appeared (leafnumber reached finalLeafNumber)" inputtype="variable" variablecategory="state" datatype="INT" max="1" min="0" default="1" unit=""/>
        <Input name="leafNumber_t1" description="Actual number of phytomers" inputtype="variable" variablecategory="state" datatype="DOUBLE" max="25" min="0" default="0" unit="leaf"/>
        <Input name="phase" description=" the name of the phase" inputtype="variable" variablecategory="state" datatype="DOUBLE" max="7" min="0" default="1" unit=""/></Inputs>
    <Outputs>
        <Output name="leafNumber" description="Actual number of phytomers" datatype="DOUBLE" variablecategory="state" max="25" min="0" unit="leaf"/></Outputs>
    <Algorithm language="cyml" platform="" filename="algo/pyx/LeafNumber.pyx"/>
    <Parametersets/>
    <Testsets/></ModelUnit>