<?xml version="1.0" encoding="UTF-8"?>
<!DOCTYPE ModelUnit PUBLIC " " "https://raw.githubusercontent.com/AgriculturalModelExchangeInitiative/crop2ml/master/ModelUnit.dtd">
<ModelUnit modelid="Crop2ML.SQ_Energy_Balance.CanopyTemperature" name="CanopyTemperature" timestep="1" version="001">
    <Description>
        <Title>CanopyTemperature model</Title>
        <Authors>Peter D. Jamieson, Glen S. Francis, Derick R. Wilson, Robert J. Martin</Authors>
        <Institution>New Zealand Institute for Crop and Food Research Ltd., New Zealand Institute for Crop and Food Research Ltd., New Zealand Institute for Crop and Food Research Ltd., New Zealand Institute for Crop and Food Research Ltd. </Institution>
        <URI></URI>
        <Reference></Reference>
        <ExtendedDescription>It is calculated from the crop heat flux and the boundary layer conductance </ExtendedDescription>
        <ShortDescription></ShortDescription></Description>
    <Inputs>
        <Input name="minTair" description="minimum air temperature" inputtype="variable" variablecategory="auxiliary" datatype="DOUBLE" max="45" min="-30" default="0.7" unit="Â°C"/>
        <Input name="maxTair" description="maximum air Temperature" inputtype="variable" variablecategory="auxiliary" datatype="DOUBLE" max="45" min="-30" default="7.2" unit="Â°C"/>
        <Input name="cropHeatFlux" description=" crop Heat Flux" inputtype="variable" variablecategory="rate" datatype="DOUBLE" max="10000" min="0" default="" unit="g m-2 d-1"/>
        <Input name="conductance" description="the boundary layer conductance" inputtype="variable" variablecategory="state" datatype="DOUBLE" max="10000" min="0" default="" unit="m/d"/>
        <Input name="lambdaV" description="latent heat of vaporization of water" inputtype="parameter" parametercategory="constant" datatype="DOUBLE" max="10" min="0" default="2.454" unit="MJ/kg"/>
        <Input name="rhoDensityAir" description="Density of air" inputtype="parameter" parametercategory="constant" datatype="DOUBLE" max="1.225" min="1.225" default="1.225" unit="kg/m**3"/>
        <Input name="specificHeatCapacityAir" description="Specific heat capacity of dry air" inputtype="parameter" parametercategory="constant" datatype="DOUBLE" max="0.00101" min="0.00101" default="0.00101" unit="MJ/kg/degC"/></Inputs>
    <Outputs>
        <Output name="minCanopyTemperature" description="minimal Canopy Temperature  " datatype="DOUBLE" variablecategory="state" max="45" min="-30" unit="degC"/>
        <Output name="maxCanopyTemperature" description="maximal Canopy Temperature " datatype="DOUBLE" variablecategory="state" max="45" min="-30" unit="degC"/></Outputs>
    <Algorithm language="cyml" platform="" filename="algo/pyx/CanopyTemperature.pyx"/>
    <Parametersets/>
    <Testsets/></ModelUnit>