<?xml version="1.0" encoding="UTF-8"?>
<!DOCTYPE ModelUnit PUBLIC " " "https://raw.githubusercontent.com/AgriculturalModelExchangeInitiative/crop2ml/master/ModelUnit.dtd">
<ModelUnit modelid="SQ.EnergyBalance.NetRadiation" name="NetRadiation" timestep="1" version="1.0">
    <Description>
        <Title>NetRadiation Model</Title>
        <Authors>Peter D. Jamieson, Glen S. Francis, Derick R. Wilson, Robert J. Martin</Authors>
        <Institution>New Zealand Institute for Crop and Food Research Ltd.,</Institution>
        <URI></URI>
        <Reference>https://doi.org/10.1016/0168-1923</Reference>
        <ExtendedDescription></ExtendedDescription>
        <ShortDescription></ShortDescription></Description>
    <Inputs>
        <Input name="minTair" description="minimum air temperature" inputtype="variable" variablecategory="auxiliary" datatype="DOUBLE" max="45" min="-30" default="0.7" unit=""/>
        <Input name="maxTair" description="maximum air Temperature" inputtype="variable" variablecategory="auxiliary" datatype="DOUBLE" max="45" min="-30" default="7.2" unit=""/>
        <Input name="albedoCoefficient" description="albedo Coefficient" inputtype="parameter" parametercategory="constant" datatype="DOUBLE" max="1" min="0" default="0.23" unit=""/>
        <Input name="stefanBoltzman" description="stefan Boltzman constant" inputtype="parameter" parametercategory="constant" datatype="DOUBLE" max="1" min="0" default="4.903E-09" unit=""/>
        <Input name="elevation" description="elevation" inputtype="parameter" parametercategory="constant" datatype="DOUBLE" max="10000" min="-500" default="0" unit="m"/>
        <Input name="solarRadiation" description="solar Radiation" inputtype="variable" variablecategory="auxiliary" datatype="DOUBLE" max="1000" min="0" default="3" unit="MJ m-2 d-1"/>
        <Input name="vaporPressure" description="vapor Pressure" inputtype="variable" variablecategory="auxiliary" datatype="DOUBLE" max="1000" min="0" default="6.1" unit="hPa"/>
        <Input name="extraSolarRadiation" description="extra Solar Radiation" inputtype="variable" variablecategory="auxiliary" datatype="DOUBLE" max="1000" min="0" default="11.7" unit="MJ m2 d-1"/></Inputs>
    <Outputs>
        <Output name="netRadiation" description="net radiation " datatype="DOUBLE" variablecategory="auxiliary" max="5000" min="0" unit="MJ m-2 d-1"/>
        <Output name="netOutGoingLongWaveRadiation" description="net OutGoing Long Wave Radiation " datatype="DOUBLE" variablecategory="auxiliary" max="5000" min="0" unit="g m-2 d-1"/></Outputs>
    <Algorithm language="cyml" platform="" filename="algo/pyx/NetRadiation.pyx"/>
    <Parametersets/>
    <Testsets/></ModelUnit>