<?xml version="1.0" encoding="UTF-8"?>
<!DOCTYPE Model PUBLIC " " "https://raw.githubusercontent.com/AgriculturalModelExchangeInitiative/xml_representation/master/ModelUnit.dtd">
<ModelUnit modelid="1" name="NetRadiationEquivalentEvaporation" timestep="1" version="1.0">
    <Description>
        <Title>NetRadiationEquivalentEvaporation Model</Title>
        <Authors>Pierre Martre</Authors>
        <Institution>INRA Montpellier</Institution>
        <Reference>absolutely non</Reference>
        <Abstract>Calculate Energy Balance </Abstract>
    </Description>
    <Inputs>
        <Input name="lambdaV" description="latent heat of vaporization of water" parametercategory="species" datatype="DOUBLE" default="2.454" min="0" max="10" unit="" uri="some url" inputtype="parameter"/>
        <Input name="netRadiation" description="" parametercategory="species" datatype="DOUBLE" default="1.566" min="0" max="1000" unit="MJ/m²d" uri="some url" inputtype="variable"/>
   
    </Inputs>
    <Outputs>

        <Output name="netRadiationEquivalentEvaporation" description=" " datatype="DOUBLE" min="0" max="5"  unit="g/m²d" uri="some url"/>

    	
    </Outputs>
    
    <Algorithm language=" " platform=""><![CDATA[
        
        netRadiationEquivalentEvaporation = netRadiation / lambdaV * 1000.0
  
      ]]>
     </Algorithm>    
    
     <Parametersets>
        <Parameterset name="set1" description="some values in there" >

        </Parameterset>

     </Parametersets>
     <Testsets>
        <Testset name="first" parameterset = "set1" description="some values in there" >
        	<Test name ="test1">
        		<InputValue name="netRadiation">1.566</InputValue>
    			<OutputValue name="netRadiationEquivalentEvaporation" precision ="3">638.142</OutputValue>
	
        	</Test>

        </Testset>
      </Testsets>
 	
</ModelUnit>