<?xml version="1.0" encoding="UTF-8"?>
<!DOCTYPE ModelUnit PUBLIC " " "https://raw.githubusercontent.com/AgriculturalModelExchangeInitiative/crop2ml/master/ModelUnit.dtd">
<ModelUnit modelid="SQ.WheatPhenology.CumulTTFrom" name="CumulTTFrom" timestep="1" version="1.0">
    <Description>
        <Title>CumulTTFrom Model</Title>
        <Authors>Pierre Martre</Authors>
        <Institution>INRA Montpellier</Institution>
        <Reference>Modeling development phase in the 
                Wheat Simulation Model SiriusQuality.
                See documentation at http://www1.clermont.inra.fr/siriusquality/?page_id=427</Reference>
        <Abstract>Calculate CumulTT </Abstract>
    </Description>
    <Inputs>
        <Input name="calendarMoments" description="List containing appearance of each stage" variablecategory="auxiliary"  datatype="STRINGLIST"  default= "['Sowing']" unit=""  inputtype = "variable"/>
		<Input name="calendarCumuls" description="list containing for each stage occured its cumulated thermal times" variablecategory="auxiliary"  datatype="DOUBLELIST" default="[0.0]" unit="°C d"  inputtype = "variable"/>
        <Input name="cumulTT" description="cumul TT at current date" datatype="DOUBLE" variablecategory="auxiliary" min="-200" max="10000" default="8" unit="°C d" inputtype = "variable"/>
      
    </Inputs>
    <Outputs>
        <Output name="cumulTTFromZC_65" description=" cumul TT from Anthesis to current date " variablecategory="auxiliary" datatype="DOUBLE" min="0" max="5000"  unit="°C d"/>
        <Output name="cumulTTFromZC_39" description=" cumul TT from FlagLeafLiguleJustVisible to current date " variablecategory="auxiliary" datatype="DOUBLE" min="0" max="5000"  unit="°C d" />
        <Output name="cumulTTFromZC_91" description=" cumul TT from EndGrainFilling to current date " variablecategory="auxiliary" datatype="DOUBLE" min="0" max="5000"  unit="°C d" />
    	
    </Outputs>
    
	<Algorithm  language="Python" platform="" filename="algo/py/CumulFrom.py" />
	<Algorithm  language="C#" platform="" filename="algo/cs/CumulFrom.cs" />
	<Algorithm  language="Java" platform="" filename="algo/java/CumulFrom.java" />
	<Algorithm  language="C++" platform="" filename="algo/cpp/CumulFrom.cpp" />
	<Algorithm  language="Fortran" platform="" filename="algo/f90/CumulFrom.f90" />
    <Algorithm  language="Cyml" platform="" filename="algo/pyx/CumulFrom.pyx" />
    <Algorithm  language="R" platform="" filename="algo/r/CumulFrom.r" />


    <Parametersets>
        <Parameterset name="wheat" description="some values in there" >
        </Parameterset>
     </Parametersets>
     <Testsets>
        <Testset name="check wheat model" parameterset = "wheat" description="some values in there" >
        	<Test name ="test_wheat1">
 				<InputValue name="calendarMoments">["Sowing", "Emergence", "FloralInitiation", "FlagLeafLiguleJustVisible", "Heading", "Anthesis"]</InputValue>
				<InputValue name="calendarCumuls">[0.0, 112.330110409888, 354.582294511779, 741.510096671757, 853.999637026622, 954.59002776961]</InputValue>
				<InputValue name="cumulTT">972.970888983105</InputValue>
				<OutputValue name="cumulTTFromZC_65" precision ="2">18.38</OutputValue>
				<OutputValue name="cumulTTFromZC_39" precision ="2">231.46</OutputValue>
				<OutputValue name="cumulTTFromZC_91" precision ="2">0</OutputValue>
        	</Test>
        </Testset>
      </Testsets>
 	
</ModelUnit>
