<?xml version="1.0" encoding="UTF-8"?>
<!DOCTYPE ModelUnit PUBLIC " " "https://raw.githubusercontent.com/AgriculturalModelExchangeInitiative/crop2ml/master/ModelUnit.dtd">
<ModelUnit modelid="SQ.WheatPhenology.UpdatePhase" name="UpdatePhase" timestep="1" version="1.0">
    <Description>
        <Title>UpdatePhase Model</Title>
        <Authors>Pierre MARTRE</Authors>
        <Institution>INRA Montpellier</Institution>
        <Reference>Modeling development phase in the 
                Wheat Simulation Model SiriusQuality.
                See documentation at http://www1.clermont.inra.fr/siriusquality/?page_id=427</Reference>
        <Abstract><![CDATA[This strategy advances the phase and calculate the final leaf number]]>
    	</Abstract>
    </Description>
    <Inputs>
        <Input name="cumulTT" description="cumul thermal times at current date" variablecategory="auxiliary" datatype="DOUBLE" min="-200" max="10000" default="354.582294511779" unit="°C d" inputtype="variable"/>
        <Input name="leafNumber" description="Actual number of phytomers" variablecategory="state" datatype="DOUBLE" min="0" max="25" default=" 4.620511621863958" unit="leaf"  inputtype = "variable"/>
        <Input name="cumulTTFromZC_39" description="cumul of the thermal time ( DeltaTT) since the moment ZC_39" variablecategory="auxiliary" datatype="DOUBLE" min="0" max="10000" default="0" unit="°C d-1"  inputtype = "variable"/>
        <Input name="isMomentRegistredZC_39" description="true if ZC_39 is registered in the calendar" variablecategory="auxiliary" datatype="INT" min="0" max="1" default="0" unit=""  inputtype = "variable"/>
        <Input name="gai" description="used to calculate Terminal spikelet" variablecategory="auxiliary" datatype="DOUBLE" min="0" max="10000" default="0.3255196285135" unit=""  inputtype = "variable"/>
        <Input name="grainCumulTT" description="cumulTT used for the grain developpment" variablecategory="auxiliary" datatype="DOUBLE" min="0" max="10000" default="0" unit="°C d"  inputtype="variable"/>
        <Input name="dayLength" description="length of the day" datatype="DOUBLE" variablecategory="auxiliary" min="0" max="24" unit="h" default="12.7433275303389" inputtype="variable" />
        <Input name="vernaprog" description="progression on a 0  to 1 scale of the vernalization" variablecategory="state" datatype="DOUBLE" min="0" max="10" default = " 1.0532526829571554" unit=""  inputtype="variable"/>
        <Input name="minFinalNumber" description="minimum final leaf number"  variablecategory="state" datatype="DOUBLE" min="0" max="25" default="6.879410413987549" unit="leaf" inputtype="variable" />
        <Input name="fixPhyll" description="Phyllochron with sowing date fix" variablecategory="state" datatype="DOUBLE" min="0" max="10000" default="91.2" unit="°C d"  inputtype="variable"/>
        <Input name="isVernalizable" description="true if the plant is vernalizable" parametercategory="constant" datatype="INT" min="0" max="1" unit="" default="1"  inputtype = "parameter"/>
        <Input name="dse" description="Thermal time from sowing to emergence" parametercategory="species" datatype="DOUBLE" min="0" max="1000" default="105" unit="°C d"  inputtype = "parameter"/>
        <Input name="pFLLAnth" description="Phyllochronic duration of the period between flag leaf ligule appearance and anthesis" parametercategory="constant" datatype="DOUBLE" min="0" max="1000" unit=""  default="2.22" inputtype = "parameter"/>
        <Input name="dcd" description="Duration of the endosperm cell division phase" parametercategory="species" datatype="DOUBLE" min="0" max="10000" default="100" unit="°C d"  inputtype = "parameter"/>
        <Input name="dgf" description="Grain filling duration (from anthesis to physiological maturity)" parametercategory="species" datatype="DOUBLE" min="0" max="10000" default="450" unit="°C d"  inputtype = "parameter"/>
        <Input name="degfm" description="Grain maturation duration (from physiological maturity to harvest ripeness)" parametercategory="species" datatype="DOUBLE" min="0" max="50" default="0" unit="°C d"  inputtype = "parameter"/>
        <Input name="maxDL" description="Saturating photoperiod above which final leaf number is not influenced by daylength" datatype="DOUBLE" min="0" max="24" default="15" unit="h"  inputtype = "parameter"/>
        <Input name="sLDL" description="Daylength response of leaf production" datatype="DOUBLE" min="0" max="1" default="0.85" unit="leaf h-1"  inputtype = "parameter"/>
        <Input name="ignoreGrainMaturation" description="true to ignore grain maturation" datatype="BOOLEAN" default="FALSE" unit=""  inputtype = "parameter"/>
        <Input name="pHEADANTH" description="Number of phyllochron between heading and anthesiss" datatype="DOUBLE" min="0" max="1000" default="1" unit=""  inputtype = "parameter"/>
        <Input name="choosePhyllUse" description="Switch to choose the type of phyllochron calculation to be used" datatype="STRING"  unit="" default="Default"  inputtype = "parameter"/>
        <Input name="p" description="Phyllochron (Varietal parameter)" parametercategory="species" datatype="DOUBLE" min="0" max="1000" default="120" unit="°C d leaf-1"  inputtype = "parameter"/>
        <Input name="phase" description=" the name of the phase" variablecategory="state" datatype="DOUBLE" min="0" max="7" default = "1" unit=""  inputtype="variable"/>
        <Input name="cumulTTFromZC_91" description="cumul of the thermal time (DeltaTT) since the moment ZC_91" variablecategory="auxiliary" datatype="DOUBLE" min="0" max="5000" default = "0" unit="°C d-1" inputtype="variable" />
        <Input name="phyllochron" description="Phyllochron" variablecategory="state" datatype="DOUBLE" min="0" max="1000" default="91.2" unit="°C d leaf-1"  inputtype = "variable"/>
        <Input name="hasLastPrimordiumAppeared" description="if Last Primordium has Appeared" variablecategory="state" datatype="INT" min="0" max="1" default="0" unit=""  inputtype="variable"/>
        <Input name="finalLeafNumber" description="final leaf number" variablecategory="state" datatype="DOUBLE" min="0" max="25" default="0" unit="leaf"  />
      
    </Inputs>
    <Outputs>
        <Output name="finalLeafNumber" description="final leaf number" variablecategory="state" datatype="DOUBLE" min="0" max="25" unit="leaf" />
        <Output name="phase" description="the name of the phase" variablecategory="state" datatype="DOUBLE" min="0" max="7" unit="" />
        <Output name="hasLastPrimordiumAppeared" description="if Last Primordium has Appeared" variablecategory="state"  datatype="INT" min="0" max="1"  unit="" />
   	
    </Outputs>
	<Algorithm  language="Python" platform="" filename="algo/py/UpdatePhase.py" />
	<Algorithm  language="C#" platform="" filename="algo/cs/UpdatePhase.cs" />
	<Algorithm  language="Java" platform="" filename="algo/java/UpdatePhase.java" />
	<Algorithm  language="C++" platform="" filename="algo/cpp/UpdatePhase.cpp" />
	<Algorithm  language="Fortran" platform="" filename="algo/f90/UpdatePhase.f90" /> 
    <Algorithm  language="Cyml" platform="" filename="algo/pyx/UpdatePhase.pyx" /> 
    <Algorithm  language="R" platform="" filename="algo/r/UpdatePhase.r" />    

     <Parametersets>
        <Parameterset name="wheat" description="some values in there" >
        	<Param name="choosePhyllUse">"Default"</Param>
        </Parameterset>

     </Parametersets>
     <Testsets>
        <Testset name="check model1" parameterset = "wheat" description="some values in there">
        	<Test name ="test_wheat1">
        		<InputValue name="phase">1</InputValue>
        		<InputValue name="hasLastPrimordiumAppeared">0</InputValue> 		
				<OutputValue name="phase" precision="1" >2</OutputValue>
				<OutputValue name="hasLastPrimordiumAppeared" >1</OutputValue>
				<OutputValue name="finalLeafNumber" precision ="2">8.80</OutputValue>
       	
        	</Test>
        </Testset>
     
      </Testsets>
 
</ModelUnit>
