<?xml version="1.0" encoding="UTF-8"?>
<!DOCTYPE ModelUnit PUBLIC " " "https://raw.githubusercontent.com/AgriculturalModelExchangeInitiative/crop2ml/master/ModelUnit.dtd">
<ModelUnit modelid="STICS.Snow.SnowWet" name="SnowWet" timestep="1" version="1.0">
	<Description>
		<Title>water in liquid state in the snow cover calculation</Title>
		<Authors>STICS</Authors>
		<Institution>INRA</Institution>
		<Reference>-</Reference>
		<Abstract>-</Abstract>
	</Description>
	<Inputs>
		<Input name="Swet_t1" description="water in liquid state in the snow cover" inputtype="variable" variablecategory="state" datatype="DOUBLE" default="0.0" min="0.0" max="100.0" unit="mm" uri=""/>
		<Input name="precip" description="current precipitation" inputtype="variable" variablecategory="auxiliary" datatype="DOUBLE" default="0.0" min="0.0" max="5000.0" unit="mm" uri=""/>
		<Input name="Snowaccu" description=" snowfall accumulation" inputtype="variable" variablecategory="state" datatype="DOUBLE" default="0.0" min="" max="" unit="mm" uri=""/>
		<Input name="Mrf" description="liquid water in the snow cover in the process of refreezing" inputtype="variable" variablecategory="state" datatype="DOUBLE" default="0.0" min="" max="" unit="mm" uri=""/>
		<Input name="M" description="snow in the process of melting" inputtype="variable" variablecategory="state" datatype="DOUBLE" default="0.0" min="" max="" unit="mm" uri=""/>
    </Inputs>
	<Outputs>
		<Output name="Swet" description="water in liquid state in the snow cover" variablecategory="state" datatype="DOUBLE" min="0.0" max="500.0" unit="mm" uri=""/>
	</Outputs>
	<Algorithm language="Cyml" platform="" filename="algo/pyx/SnowWet.pyx" />
	<Parametersets>
		<Parameterset name="paramerSet1" description="set Parameters for TempMax unit" >
		</Parameterset>
	</Parametersets>
	<Testsets>
        <Testset name="check snow model" parameterset = "paramerSet1" description="some values in there" >
        	<Test name ="test_snow1">
                <InputValue name="M">91.2</InputValue>
                <InputValue name="Mrf">91.2</InputValue>
                <InputValue name="Snowaccu">91.2</InputValue>
        		<InputValue name="precip">91.2</InputValue>
				<InputValue name="Swet_t1">0.279</InputValue> 
			    <OutputValue name="Swet" precision ="2">45.6</OutputValue>
        	</Test>
        </Testset>
	</Testsets>
</ModelUnit>