<?xml version="1.0" encoding="UTF-8"?>
<!DOCTYPE ModelUnit PUBLIC " " "https://raw.githubusercontent.com/AgriculturalModelExchangeInitiative/crop2ml/master/ModelUnit.dtd">
<ModelUnit modelid="STICS.Snow.SnowDensity" name="SnowDensity" timestep="1" version="1.0">
	<Description>
		<Title>Density of snow cover calculation</Title>
		<Authors>STICS</Authors>
		<Institution>INRA</Institution>
		<Reference>-</Reference>
		<Abstract>-</Abstract>
	</Description>
	<Inputs>
		<Input name="ps_t1" description="density of snow cover in previous day" inputtype="variable" variablecategory="state" datatype="DOUBLE" default="0.0" min="0.0" max="100.0" unit="kg m-3" uri=""/>
		<Input name="Sdepth_t1" description="snow cover depth Calculation in previous day" inputtype="variable" variablecategory="state" datatype="DOUBLE" default="0.0" min="0.0" max="5000.0" unit="m" uri=""/>
		<Input name="Sdry_t1" description="water in solid state in the snow cover in previous day" inputtype="variable" variablecategory="state" datatype="DOUBLE" default="0.0" min="0.0" max="500.0" unit="mm" uri=""/>
		<Input name="Swet_t1" description="water in liquid state in the snow cover" inputtype="variable" variablecategory="state" datatype="DOUBLE" default="0.0" min="0.0" max="100.0" unit="mm" uri=""/>
    </Inputs>
	<Outputs>
		<Output name="ps" description="density of snow cover" variablecategory="state" datatype="DOUBLE" min="0.0" max="500.0" unit="kg m-3" uri=""/>
	</Outputs>
	<Algorithm language="Cyml" platform="" filename="algo/pyx/SnowDensity.pyx" />
	<Parametersets>
		<Parameterset name="paramerSet1" description="set Parameters for TempMax unit" >
		</Parameterset>
	</Parametersets>
	<Testsets>
        <Testset name="check snow model" parameterset = "paramerSet1" description="some values in there" >
        	<Test name ="test_snow1">
                <InputValue name="Sdry_t1">91.2</InputValue>
                <InputValue name="Swet_t1">91.2</InputValue>
                <InputValue name="Sdepth_t1">91.2</InputValue>
				<InputValue name="ps_t1">0.279</InputValue> 
			    <OutputValue name="ps" precision ="2">45.6</OutputValue>
        	</Test>
        </Testset>
	</Testsets>
</ModelUnit>